"original_title","original_indicator_code","our_title","short_indicator_description_de","short_indicator_description_en","long_indicator_description_de","long_indicator_description_en","unit","target","explanation_of_target","scoring","last_update","extracted","source_of_data","source_note","indicator_type","indicator_source","link","type","sdg","most_recent_year","ministerial_responsibility"
"Recycling rate of e-waste","t2020_rt130","Recycling von Elektromüll","Dieser Indikator zeigt wie effektiv das Recycling von Elektromüll ist anhand der Sammelquote multipliziert bei der Effizienz der Abhandlung von Elektro- und Elektronik-Altgeräten (WEEE).","The indicator presents the effective recycling rate of e-waste which is the collection rate multiplied by the efficiency of treatment of waste electrical and electronic equipment (WEEE). ","Elektro- und Elektronikmüll sind auf Grund vieler schädlicher Bestandteile ein Risiko für unsere Umwelt. Allerdings bieten sie ein hohes Recyclingpotenzial durch seltene Metalle und andere hochwertigen Materialien. Dieser Indikator zeigt wie effektiv das Recycling von Elektromüll ist anhand der Sammelquote multipliziert bei der Effizienz der Abhandlung von Elektro- und Elektronik-Altgeräten (WEEE). WEEE kann nicht verglichen werden mit den Massen an Elektronik die jährlich auf den Markt kommen da Elektro- und Elektronikgeräte meistens weit länger als ein Jahr im Umlauf sind bevor sie entsorgt werden. Daher beruht die Sammelquote auf dem Gesamtgewicht des Elektromülls der in dem Jahr gesammelt wurde und dem Durchschnittsgewicht von Elektromüll der letzen drei Jahre in Prozenten.","Electrical and electronic waste (e-waste) is a risk to environment because of its hazardous components. However, it also provides a high potential for recycling precious metals and other highly valuable materials. The indicator presents the effective recycling rate of e-waste which is the collection rate multiplied by the efficiency of treatment of waste electrical and electronic equipment (WEEE). WEEE cannot simply be regarded as being equivalent to the amount put on the market in the same year, as EEE often takes longer than one year to become a waste. Therefore, the collection rate is calculated on the basis of the total weight of WEEE collected in the respective year expressed as a percentage of the average weight of EEE placed on the market (PoM)in the three preceding years: Collection rate yi = 3*WEEE collectedyi / (PoM yi-1+ PoMyi-2 + PoMyi-3). ","Prozent","45","From 2016, the annual collection target will be defined as the ratio between the collected amount and the average weight of EEE put on the market in the three preceding years. The collection target is set at 45 % in 2016 and will rise to 65 % in 2019.",,"30.11.2015",,"Eurostat","","national","OKF","http://ec.europa.eu/eurostat/tgm/table.do?tab=table&init=1&plugin=0&language=en&pcode=t2020_rt130","[""ecologic""]","[9]",2012,"[""BMUB""]"
"Recycling rate of municipal waste ","t2020_rt120","Recycling von Haushaltsmüll","Der Indikator gibt in Prozent an wie viel Haushaltsmüll im jewiligen Land recyclet wird. ","The indicator shows how many percent of municipal waste gets recycled per year in a certain country. ","Haushaltsmüll besteht zu einem großen Teil aus Müll von Haushalten, kann aber auch ähnlichen Müll von kleinen Unternehmen und öffentlichen Institutionen beinhalten sowie Müll der nicht von der Kommune gesammelt wird. Diese letzte Komponente variiert von Kommune zu Kommune und von Land zu Land und ist abhängig vom lokalen Abfallmanagmentsystem. Für Gegenden ohne kommunales Abfallmanagementsystem wird die Müllmenge geschätzt. Die Daten beinhalten keinen Müll aus Agrarwirtschaft, Industrie und dem kommunalen Abwassersystem sowie kommunalen Bauabfällen und Schutt.","Municipal waste consists to a large extent of waste generated by households, but may also include similar wastes generated by small businesses and public institutions and wastes not collected by the municipality; this part of municipal waste may vary from municipality to municipality and from country to country, depending on the local waste management system. For areas not covered by a municipal waste collection scheme the amount of waste generated is estimated. The data do not include waste from agriculture, from industries, from the municipal sewage network and treatment, as well as municipal construction and demolition waste.","Prozent (Anteil Müll der recyclelt wird vom gesamten Haushaltsmüll)","100","",,"09.11.2015",,"Eurostat","The recycling rate is the tonnage recycled from municipal waste divided by the total municipal waste arising. Recycling includes material recycling, composting and anaerobic digestion. Municipal waste consists to a large extent of waste generated by households, but may also include similar wastes generated by small businesses and public institutions and collected by the municipality; this latter part of municipal waste may vary from municipality to municipality and from country to country, depending on the local waste management system. This variation in scope across the Member States means that cross-country comparison is problematic. For areas not covered by a municipal waste collection scheme the amount of waste generated is estimated. The Member states report each year the amount recycled and the total municipal waste generated to Eurostat.","national","OKF","http://ec.europa.eu/eurostat/tgm/graph.do?tab=graph&plugin=0&language=en&pcode=t2020_rt120&toolbox=type","[""ecologic""]","[11]",2013,"[""BMUB""]"
"Financial Secrecy Index","","Intransparenz der Finanzmärkte","Dieser Indikator bewertet die Transparenz der Finanzmärkte und wird vom Tax Justice Network entwickelt.","This indicator assesses the lack of transparency in financial markets. It is developed by the Tax Justice Network.","Der Financial Secrecy Index bewertet Staaten bzw. Gebiete mit eigenem Rechtssystem im Bezug auf die Intransparenz des Finanzmarktes und des Umfangs der offshore Finanzaktivitäten. Für den 2030-Watch Indikator wird lediglich die Bewertung der Intransparenz der Finanzmärkte zugrunde gelegt. Der Index ist politisch unabhängig und zielt darauf ab, ein besseres Verständnis üer die Intransparenz des globalen Finanzsystems, illegale Finanzflüsse und Kapitalflucht zu fördern. Der Index wird vom Tax Justice Network entwickelt und unterhalten und basiert auf umfangreichen Länderstudien. Details über die Methodologie und die Datenbasis finden sich auf der Webseite des FSI: http://www.financialsecrecyindex.com/. Der Financial Secrecy Index bewertet alle britischen überseeischen Gebiete und Gebiete, die der Britischen Krone unterstehen separat. Würde diese Gebiete aggregiert bewertet, so würde Groß Britannien den höchsten Wert für Intransparenz erhalten. ","The Financial Secrecy Index ranks jurisdictions according to their secrecy and the scale of their offshore finanical activities. For the 2030-Watch indicator only the data for secrecy is used. A politically neutral ranking, it is a tool for understanding global financial secrecy, tax havens or secrecy jurisdictions, and illicit financial flows or capital flight. The index is developed and mainained by the Tax Justice Network and is based on desk research. Details about the methodology and the information taken into account are found on the FSI website: http://www.financialsecrecyindex.com/. The index ranks British Overseas Territories and Crown Dependencies separately. If all these jurisdictions were aggregated the UK would receive the highest rate for secrecy.","Punkte nach FSI Methodology","20","",,,,"Tax Justice Network","The Financial Secrecy Index ranks jurisdictions according to their secrecy and the scale of their offshore finanical activities. A politically neutral ranking, it is a tool for understanding global financial secrecy, tax havens or secrecy jurisdictions, and illicit financial flows or capital flight.","global","OKF","http://www.financialsecrecyindex.com/introduction/fsi-2015-results","[""economic"",""social""]","[8,16]",2015,"[""BMF""]"
"Proportion of seats held by women in national parliaments (%)","SG.GEN.PARL.ZS","Anteil der Frauen in nationalen Parlamenten","Anteil der Frauen in nationalen Parlamenten ","Women in parliaments are the percentage of parliamentary seats in a single or lower chamber held by women.","","","% aller Abgeordneten des nationalen Parlaments","50","",,,,"World Bank","Women in parliaments are the percentage of parliamentary seats in a single or lower chamber held by women.","national","IAEG","http://data.worldbank.org/indicator/SG.GEN.PARL.ZS","[""social""]","[5]",2014,"[]"
,"","Wahrscheinlichkeit zwischen exakt 30 und 70 Jahren an Folge einer Herz- oder anderen schweren Krankheit zu sterben.","Wahrscheinlichkeit zwischen 30 und 70 Jahren an einer Krankheit zu sterben","Probability of mortality between the age of 30 and the age of 70 from a disease","Mortalitätswahrschenlichkeit berechnet anhand der registrierten Todesdaten, epidemologischen Daten und Krankheitsregistrierung in dem jeweiligen Land. Der Indikator gibt die Wahrscheinlichkeit in Prozent an. Dieser Indikator wurde von dem Sustainable Development Solutions Network vorgeschlagen, um SDG 3 zu messen.","Probability of mortality is based on death-registration data, epidemiological studies and disease registers of a country. The indicator expresses the mortality in percent. This indicator was suggested by the Sustainable Development Solutions Network to measure SDG3.","Prozent",,"",,"27.10.2015",,"WHO","","national","SDSN","http://apps.who.int/gho/data/view.main.2485","[""social""]","[3]",,"[""BMG""]"
"Suicide rates, Total, Per 100 000 persons","doi: 10.1787/a82f3459-en","Suizidrate","Suizidrate pro 100.000 Einwohner pro Jahr","Rate of suicides per 100.000 inhabitants per year","Der Indikator Selbstmordrate ist definiert als Anzahl der Tode, die von der verstorbenen Person bewußt herbeigeführt und ausgeführt wurden im vollen Wissen und in der Erwartung des tödlichen Konsequenz. Die Vergleichbarkeit der Daten zwischen den Ländern wird beeinflusst durch die unterschiedlichen Kriterien der Berichtserstattung beispielsweise im Hinblick darauf, wie die Intention der Selbsttötung bewertet wird, wer die Todesbescheinigung ausfüllt, ob eine forenische Untersuchung stattgefunden hat und inwiefern Datenschutzbestimmungen zu Todesursachen bestehen. Ein Ländervergleich ist daher nur eingeschränkt möglich. Der Indikator gibt die Anzahl der Selbstmordfälle pro 100.000 Personen an.(Quelle: OECD)","Suicide rates are defined as the number of deaths deliberately initiated and performed by a person in the full knowledge or expectation of its fatal outcome. Comparability of data between countries is affected by a number of reporting criteria, including how a person's intention of killing themselves is ascertained, who is responsible for completing the death certificate, whether a forensic investigation is carried out, and the provisions for confidentiality of the cause of death. Caution is required therefore in interpreting variations across countries. This indicator is measured in terms of deaths per 100 000 persons.(Source: OECD)","Total pro 100000 Einwohner","5","","below 5 = 1 = very good, below 10 = 2 = good, below 15 = 3 = satisfactory, below 20 = 4 = bad, 30 and above = 5 = very bad","","30.10.2015","OECD","","national","OKF","https://data.oecd.org/healthstat/suicide-rates.htm","[""social""]","[3]",2013,"[""BMG""]"
"Intentional homicides (per 100 000 people)","VC.IHR.PSRC.P5","Vorsätzliche Tötungsdelikte ","Vorsätzliche Tötungsdelikte sind Schätzungen von gesetzeswiedriger Tötung, größtenteils ausgenommen von großen organisierten Tötungen in bewaffneten Konflikten","Intentional homicides are estimates of unlawful homicides purposely inflicted and mostly excluiding large organised killing in armed conflict","Vorsätzliche Tötungsdelikte sind Schätzungen von gesetzeswiedriger Tötung die beabsichtigt aus häuslichen Auseinandersetzungen, zwischenmenschlicher Gewalt, Gewaltkonflikten über Landressourcen, Gewalt unter Gangs über Revier oder Kontrolle, Raubgewalt und Tötung durch bewaffnete Gruppen. Überwiegend ausgenommen sind große organisierte Tötungen im Rahmen von bewaffneten Konflikten und bei einer Truppengröße von bis zu mehreren hundert  Personen.","Intentional homicides are estimates of unlawful homicides purposely inflicted as a result of domestic disputes, interpersonal violence, violent conflicts over land resources, intergang violence over turf or control, and predatory violence and killing by armed groups. Intentional homicide does not include all intentional killing; the difference is usually in the organization of the killing. Individuals or small groups usually commit homicide, whereas killing in armed conflict is usually committed by fairly cohesive groups of up to several hundred members and is thus usually excluded.","per 100000 Menschen","0","Je weniger Tötungsdelikte, desto besser.",,,,"World Bank","Intentional homicides are estimates of unlawful homicides purposely inflicted as a result of domestic disputes, interpersonal violence, violent conflicts over land resources, intergang violence over turf or control, and predatory violence and killing by armed groups. Intentional homicide does not include all intentional killing; the difference is usually in the organization of the killing. Individuals or small groups usually commit homicide, whereas killing in armed conflict is usually committed by fairly cohesive groups of up to several hundred members and is thus usually excluded.","national","OKF","http://data.worldbank.org/indicator/VC.IHR.PSRC.P5","social","[16]",2012,"[""BMJ""]"
"Forest Change (FORCH) - Change in forest cover between 2000 and 2012 (%)","FORCH","Veränderung in der Waldfläche","Veränderung der Waldfläche eines Landes zwischen 2000 und 2012 in Prozent. Negative Werte bedeuten Verlust an Waldfläche.","Change of forest cover between 2000 and 2012 in percentage. Nevative values represent loss of forest cover.","Veränderung der Waldfläche ist ein Indikator, der im Rahmen des Yale Environmental Performance Index entwickelt wurde. Er misst die Veränderung der Waldfläche eines Landes zwischen 2000 und 2012 in Gebieten, die im Jahr 2000 zu mehr als 50% mit Bäumen bedeckt war. Er berücksichtigt Gebiete mit Waldverlust, Wiederaufforstung und Aufforstung. Wälder sind dynamische Ökosysteme, die kritisch sind für ökologisches Gleichgewicht, Biodiversität und menschlichen Wohlstand. Wälder spielen eine kritische Rolle bei der Eindämmung des Klimawandels und liefern wichtige Dienstleistungen und Produkte. Eine Verringerung der Waldfläche has deutliche negative Auswirkungen auf Ökosystemleistungen und den Schutz von Lebensräumen. Die Daten für diesen Index stammen aus einem Forschungsprojekt der Universität Maryland (USA) und beruhen auf Daten der UN Organisation für Ernährungswissenschaften und Landwirtschaft (FAO) sowie auf der Analyse von Satellitenbildern. Insbesondere die FAO Daten haben Qualitätsmängel, die teilweise von den Satellitendaten aufgewogen werden. Mehr Informationen zur Datenqualität finden sich hier: http://epi.yale.edu/our-methods/forests. (Source EPI)","The Change in Forest Cover is an indicator proposed by the Yale Environmental Performance Index. It measures the percent change in forest cover between 2000 and 2012 in areas with greater than 50 percent tree cover in the year 2000. It factors in areas of forest loss (including deforestation), reforestation (forest restoration or replanting), and afforestation (conversion of bare or cultivated land into forest). Forests are dynamic ecosystems vital to sustaining natural life cycles, biodiversity, and the prosperity of humankind. Forests play a critical role in mitigating the effects of climate change and providing integral ecosystem services and products. A reduction in the extent of forest cover has significant negative implications for ecosystem services and habitat protection. The data  provided by a research project at the university of Maryland (USA) and is based on FAO data and satellite images. Particularly the FAO data has quality issues which are partially corrected by satellite images. More information on the data quality is provided on the EPI website: http://epi.yale.edu/our-methods/forests. (Source: EPI)","Prozent","0","0 % Veränderung ist ein sehr moderates Ziel angesichts der Bedeutung von Wald für den Klimawandel.",,"27.10.2015",,"Yale Environmental Performance Index","M.C. Hansen et al. (2013). High-Resolution Global Maps of 21st-Century Forest Cover Change. Science. 342 (6160): 850-853.,","global","[""OKF""]","http://epi.yale.edu/epi/issue-ranking/forests","[""ecologic""]","[15]",2012,"[""BMUB""]"
"Basel AML Index","","Geldwäsche und Terrorfinanzierung","Für diesen Indikator wird anhand von 14 Einzelindikatoren aus öffentlichen Quellen wie Korruption, finanzielle Standards, politische Offenlegung und Rechtsstaatlichkeit gemessen wie hoch das Risiko in einem Land zu Geldwäsche und Terrorfinanzierung ist","For this indicator the risk of money laundering and terrorist financing of countries based on 14 indicators incluiding corruption, financial standards, political disclosure and rule of law are aggregated into one overall risk score","Für diesen Indikator wird gemessen wie hoch das Risiko zu Geldwäsche und Terrorfinanzierung ist. Dazu werden 14 Einzelindikatoren aus öffentlich zugänglichen Quellen wie Korruption, finanzielle Standards, politische Offenlegung und Rechtsstaatlichkeit zu einem übergeordneten Risikowert aggregiert","The indicator measures the risk of money laundering and terrorist financing of countries. Therefor a total of 14 indicators based on publicly available sources incluiding corruption, financial standards, political disclosure and rule of law are aggregated into one overall risk score.","Punkte","0","wenig Risko (0 Punkte) bis hohes Risiko (10 Punkte)",,,,"Basel Institute on Governance","The Basel AML Index measures the risk of money laundering and terrorist financing of countries based on publicly available sources. A total of 14 indicators that deal with AML/CFT regulations, corruption, financial standards, political disclosure and rule of law are aggregated into one overall risk score. By combining these various data sources, the overall risk score represents a holistic assessment addressing structural as well as functional elements in the AML/CFT framework. As there are no quantitative data available, the Basel AML Index does not measure the actual existence of money laundering activity or amount of illicit financial money within a country but is designed to indicate the risk level, i.e. the vulnerabilities of money laundering and terrorist financing within a country. The Basel AML Index ranks countries based on the overall score and provides data that is useful for comparative purposes. However it should be stressed that the primary objective is not to rank countries in comparison to each other. Rather, the Basel AML Index seeks to provide an overall picture of a country’s risk level and to serve as a solid starting point for examining progress over time","global","OKF","https://index2015.baselgovernance.org/sites/index/documents/Basel_AML_Index_Report_2015.pdf","[""economic""]","[16]",2015,"[""BMJ""]"
,"","Anzahl Migranten aus nicht DAC-Ländern aus dem vergangenen Jahr ","Anteil der Migranten aus Entwicklungsländern an der Gesamtbevölkerung","Share of migrants from developing countries in overall population","Offenheit der OECD Länder gegenüber Migranten ermöglicht den Migranten aus sogenannten Entwicklungsländern höhere Einkommen zu verdienen und teilweise nach Hause zu schicken, eine Ausbildung zu erhalten und mit mehr Fähigkeiten und Kapital nach hause zurückzukehren. Der Migrationsindikator wurde vom Center for Global Development (CGD) im Rahmen des Commitment to Development Index (CDI) entwickelt. Er misst die Zuwanderung von Migranten aus sogenannten Entwicklungsländern im Verhältnis zur Gesamtbevölkerung eines Landes. Die Daten stammen von nationalen Migrationsbehörden, die an die OECD berichten und berücksichtigt nur sehr bedingt illegale Migration. Die Zuwanderung von Migranten aus ärmeren Ländern wird höher bewertet als die Zuwanderung aus Ländern mit höherem durchschnittlichen Einkommen. Weitere Informationen zu diesem Indikator finden sich im CDI Technical Paper.","Openness of OECD countries to migrants creates opportunities for them to earn more, send home money, get education, and return with new skills and capital. This indicator has been developed by the Center for Global Development (CGD) in the context of the Commitment to Development Index (CDI). It measures the gross inflow of migrants from developing countries per year as a share of receiving country population. Figures come from immigration agencies that report to the OECD. These figures miss most likely illegal migrants. Immigration from poorer countries is rewarded more than immigration from countries with higher average income. For more details on this indicator please consult the CDI Technical Paper.","Prozent","1","",,"27.10.2015",,"Commitment to Development Index, Center for Global Development ","Gross inflow of migrants from developing countries per year as a share of receiving country population. Figures come from immigration agencies and most likely miss illegal migrants. Immigration from poorer countries is rewarded more. Openness to migrants creates opportunities for them to earn more, send home money, get education, and return with new skills and capital.","pcd","[""Other: CDI""]","http://www.cgdev.org/initiative/commitment-development-index/index","[""social"",""economic""]","[10]",2013,"[""BMI"",""BMAS""]"
"Refugees and asylum applications accepted","","Anzahl Flüchtlinge in einem Land plus kürzlich genemigte Asylanträge",,,"Dieser Indikator beruht auf der Anzahl der Flüchtlinge, die in einem Land leben und die Anzahl der akzeptieren Asylanträge im vergangenen Jahr. Die Gesamtzahl der Personen wird durch das Bruttoinlandsproduktes des Landes geteilt. Bei diesem Indikator werden auch die Personen berücksichtigt, die vom UN Hochkommissariat als besonders schutzbedürftig betrachtet werden. Dieser Indikator wurde vom Center for Global Development (CGD) im Rahmen des Commitment to Development Index (CDI) entwickelt. Er beruht auf einer vereinfachten Version eines UNHCR Indizes und auf UNHCR Daten. Dieser Indikator berücksichtigt noch nicht die aktuellen Entwicklungen in der Flüchtlingspoliti.","This indicator adds together the number of refugees living in a country and the number of asylum applications accepted in a recent year, all divided by the host country's gross domestic product. The number of refugees include other 'persons of concern' as defined by the U.N. High Commissioner for Refugees (UNHCR). The indicator was developed by the Center for Global Development (CGD) in the context of the Commitment to Development Index (CDI) using a simplified version of the UNHCRs index and UNHCR data. This indicator does not yet take into account the current developments in migration flows in Europe.","Personen pro Billionen Dollar GDP","700","",,"27.10.2015",,"The Commitment to Development Index, Center for Global Development ","This indicator adds together the number of refugees living in a country and the number of asylum applications accepted in a recent year, all divided by the host country's gross domestic product.","pcd","CDI","http://www.cgdev.org/initiative/commitment-development-index/index","[""economic""]","[10]",2014,"[""BMAS""]"
